{
  "$schema": "./tokens.schema.json",
  "schema_version": 1,
  "network": "mainnet",
  "templates": [
    {
      "id": "kcc20-ref-3x3",
      "family": "kcc20",
      "template_hash": "173ca6a796c2c05f171c31b9a73aaca161a3226a9e8f57d2f3d833ff18dbe41b",
      "prefix_len": 1,
      "suffix_len": 2802,
      "state_len": 112,
      "max_token_inputs": 3,
      "max_token_outputs": 3,
      "escrow": {
        "owner_scheme": 4,
        "borrow_scheme": 0
      },
      "review_status": "reviewed",
      "risks": [
        "A UTXO owned (owner_scheme 4) by the token's own covenant id is spendable by anyone (any input of the token unlocks it); KOB never creates such an output (informational).",
        "Genesis contamination: the covenant id commits only to the P2SH hashes of the genesis outputs, so a genesis may hide a non-template output able to mint look-alike tokens or feed a fake balance into a transfer; a token is verified only after every genesis output was checked (registry genesis record), until then it carries the warning genesis-unchecked.",
        "Reviewed (internal review only, no independent audit; maintainer decision 2026-10-12, canary launch): KOB's standard KCC-20 program, tradable on mainnet without a registry entry (issuance is permissionless). Basis: the engine conformance suites, the KAS-book order suites and their ablation run on it, the compute-budget table covers it. A token is listed or official only after verify_genesis passes on its genesis group."
      ],
      "source": {
        "path": "contracts/artifacts/KCC20Ref.json",
        "upstream": "https://github.com/argent-lang/kcc20-reference master, commit c8a087117735a1f87c5c6d115fcddeaf2562c784 (pull request 1 merged; contracts/kcc20.ag built as a single-actor app; unaudited)",
        "note": "Pre-audit notes (reference program, engine conformance suites in crates/kob-tests): one leader plus delegators, owner-authorised transfers only, no mint, burn, freeze or seize entry. Reference KCC-20 at its default 3 token inputs / 3 outputs per transfer: KOB's standard token program, the one kob token issue and the web app issue by default."
      }
    },
    {
      "id": "kcc20-ref-8x8",
      "family": "kcc20",
      "template_hash": "666da060d02663939efdc534ea10cce219e5564af86f4cc8eeea2ca129f7c032",
      "prefix_len": 1,
      "suffix_len": 6237,
      "state_len": 112,
      "max_token_inputs": 8,
      "max_token_outputs": 8,
      "escrow": {
        "owner_scheme": 4,
        "borrow_scheme": 0
      },
      "review_status": "pending-review",
      "risks": [
        "A UTXO owned (owner_scheme 4) by the token's own covenant id is spendable by anyone (any input of the token unlocks it); KOB never creates such an output (informational).",
        "Genesis contamination: the covenant id commits only to the P2SH hashes of the genesis outputs, so a genesis may hide a non-template output able to mint look-alike tokens or feed a fake balance into a transfer; a token is verified only after every genesis output was checked (registry genesis record), until then it carries the warning genesis-unchecked."
      ],
      "source": {
        "path": "contracts/artifacts/KCC20Ref_8x8.json",
        "upstream": "https://github.com/argent-lang/kcc20-reference master, commit c8a087117735a1f87c5c6d115fcddeaf2562c784 (pull request 1 merged; contracts/kcc20.ag built as a single-actor app; unaudited)",
        "note": "Pre-audit notes (reference program with 8/8 slots, engine conformance suites in crates/kob-tests): owner-authorised transfers only, no mint, burn, freeze or seize entry. Prototype, not issued by KOB (KOB issues the standard 3/3 reference): the reference with 8/8 slot limits (only MAX_DELEGATES, MAX_TOKEN_OUTPUTS and the loop bounds differ), kept so that tokens issued with it on testnet stay tradable. No mint, burn or public-mint entry."
      }
    },
    {
      "id": "kron-2433",
      "family": "kron",
      "template_hash": "2ed46a7edf5b168e67dba56998c58255235bebac436940a85115ca31d5c559f2",
      "prefix_len": 0,
      "suffix_len": 2387,
      "state_len": 46,
      "max_token_inputs": 4,
      "max_token_outputs": 5,
      "escrow": {
        "id_type": 2,
        "is_minter": 0,
        "delivery_id_type": 3
      },
      "review_status": "reviewed",
      "capabilities": [
        "mint-authority"
      ],
      "risks": [
        "The is_minter path lets a live minter mint without limit: capability mint-authority.",
        "Missing hardening present in kron-2732: does not refuse an all-zero owner on id_type 2 and does not refuse out-of-range output id types; the KOB orders never create such outputs (a plain UTXO carrying an order script fails the order's covenant-count check).",
        "KRON id_type 3 (address presence) balances, the type KOB delivers to makers, are authorised by any P2PK input of the owner key: a maker signature with a partial sighash (SINGLE, NONE, ANYONECANPAY) would authorise all of that key's type-3 balances. KOB signers use SIGHASH_ALL only.",
        "Genesis contamination: the covenant id commits only to the P2SH hashes of the genesis outputs, so a genesis may hide a non-template output able to mint look-alike tokens or feed a fake balance into a transfer; a token is verified only after every genesis output was checked (registry genesis record), until then it carries the warning genesis-unchecked.",
        "Reviewed with conditions (internal review 2026-09-30, not an independent audit): a token is listed or official only after verify_genesis passes on its real genesis group and no live is_minter cell exists (its genesis record; a genesis without a minter output proves none can appear; a token with a live minter lists only with an active-mint-authority warning). Checked at review: order genesis groups are the order output alone, IOC returns are positional, x402 treats the token as issuer-controlled."
      ],
      "source": {
        "path": "contracts/adapters/kron/templates/kron_token_2433.bin",
        "upstream": "KRON API /api/native/cp-template (api.kron.technology); checked against redeem scripts observed on mainnet",
        "note": "Pre-audit notes (adapter study and token census of 2026-09-29): one entry, owner-authorised only, no admin, freeze or seize path; the is_minter=1 branch is reachable only from the curve and an escrowed non-minter input rejects any minting transaction; 33 negative tests in crates/kob-tests/tests/kob_kron_adapter_tests.rs. Common KRON token program (85 of 91 registry tokens at 2026-09-28). Internal review (2026-09-30, not an independent audit): reviewed with the conditions in risks."
      }
    },
    {
      "id": "kron-2732",
      "family": "kron",
      "template_hash": "8097c96fe586a785b3ffb62ddd2a9b3012593421d605d136d26153806e28053e",
      "prefix_len": 0,
      "suffix_len": 2686,
      "state_len": 46,
      "max_token_inputs": 4,
      "max_token_outputs": 5,
      "escrow": {
        "id_type": 2,
        "is_minter": 0,
        "delivery_id_type": 3
      },
      "review_status": "reviewed",
      "capabilities": [
        "mint-authority"
      ],
      "risks": [
        "The is_minter path lets a live minter mint without limit: capability mint-authority.",
        "KRON id_type 3 (address presence) balances, the type KOB delivers to makers, are authorised by any P2PK input of the owner key: a maker signature with a partial sighash (SINGLE, NONE, ANYONECANPAY) would authorise all of that key's type-3 balances. KOB signers use SIGHASH_ALL only.",
        "Genesis contamination: the covenant id commits only to the P2SH hashes of the genesis outputs, so a genesis may hide a non-template output able to mint look-alike tokens or feed a fake balance into a transfer; a token is verified only after every genesis output was checked (registry genesis record), until then it carries the warning genesis-unchecked.",
        "Reviewed with conditions (internal review 2026-09-30, not an independent audit): a token is listed or official only after verify_genesis passes on its real genesis group and no live is_minter cell exists (its genesis record; a genesis without a minter output proves none can appear; a token with a live minter lists only with an active-mint-authority warning). Checked at review: order genesis groups are the order output alone, IOC returns are positional, x402 treats the token as issuer-controlled."
      ],
      "source": {
        "path": "contracts/adapters/kron/templates/kron_token_2732.bin",
        "upstream": "KRON API /api/native/cp-template (api.kron.technology); checked against redeem scripts observed on mainnet",
        "note": "Pre-audit notes (same semantics as kron-2433, adapter tests pass on both templates; newer KRON launches 2026-09-06 to 09-27). Newer KRON token program (6 tokens launched 2026-09-06 to 09-27). Internal review (2026-09-30, not an independent audit): reviewed with the conditions in risks."
      }
    },
    {
      "id": "kcc20-kaspacom-0-2-5",
      "family": "kcc20",
      "template_hash": "911f0638ccb7368bf36d117f1725073ae7ee487ce8b58ca3e8375051c2d40f6c",
      "prefix_len": 1,
      "suffix_len": 25439,
      "state_len": 112,
      "max_token_inputs": 8,
      "max_token_outputs": 8,
      "escrow": {
        "owner_scheme": 4,
        "borrow_scheme": 0
      },
      "review_status": "pending-review",
      "capabilities": [
        "mint-authority",
        "public-mint",
        "burn"
      ],
      "risks": [
        "A UTXO owned (owner_scheme 4) by the token's own covenant id is spendable by anyone (any input of the token unlocks it); KOB never creates such an output (informational).",